filename,title,version,author,category,description,automation,complexity,created_date,dependencies,difficulty,documentation,estimated_learning_time,language,learning_curve,maintenance,mcp_tools,output_formats,overall_score,practicality,prerequisites,principles,ratings,recommended_for,scalability,tags,time_to_result,updated_date,use_cases
01_bioinformatic.md,生物信息学专家AI提示词,v0.2.0,GQY,专业领域,专业的生物信息学AI助手提示词，支持基因组学分析、植物分类学、文献检索等功能,"7        # 自动化程度 (1-10, 10最自动化)",高级,2025-06-22,,"9        # 难度等级 (1-10, 10最难)","9     # 文档完整度 (1-10, 10最完整)",2-3个月,中文,"8    # 学习曲线 (1-10, 10最陡峭)","6       # 维护难度 (1-10, 10最难维护)","article-mcp, biomcp, fetch, playwright, 知识库查询",,7.9     # 总体评分 (1-10),"9      # 实用性 (1-10, 10最实用)","生物学基础知识, 统计学基础, R/Python编程经验, Linux系统使用经验",,,"生物信息学研究人员, 基因组学专家, 植物学研究者, 生物数据分析师","8       # 可扩展性 (1-10, 10最可扩展)","生物信息学, 基因组学, 数据分析, 文献检索, MCP工具, 专业术语","7    # 出结果速度 (1-10, 10最快)",2025-07-16,"生物信息学研究, 基因组学分析, 植物分类学, 生物数据分析"
02_chart_generation.md,图表生成专家AI提示词,v0.1.0,数据可视化工作流团队,数据可视化,专业的图表生成AI助手，提供前端和Python双重实现方案,"8        # 自动化程度 (1-10, 10最自动化)",中级,2025-07-16,,"6        # 难度等级 (1-10, 10最难)","8     # 文档完整度 (1-10, 10最完整)",2-4周,中文,"5    # 学习曲线 (1-10, 10最陡峭)","4       # 维护难度 (1-10, 10最难维护)","mcp-server-chart, Python脚本生成, 数据分析工具","JavaScript代码, Python脚本, 环境配置",7.0     # 总体评分 (1-10),"9      # 实用性 (1-10, 10最实用)","基础数据分析概念, JavaScript或Python基础, 统计学基础知识",,,"数据分析师, 产品经理, 市场研究人员, 业务分析师, 可视化设计师","7       # 可扩展性 (1-10, 10最可扩展)","图表生成, 数据可视化, Python脚本, 前端图表, 统计分析, AntV, matplotlib, seaborn","9    # 出结果速度 (1-10, 10最快)",2025-07-16,"数据可视化, 图表生成, 统计分析, 报告制作, 仪表板设计"
03_python_project.md,Python项目开发工作流 - AI助手指南,v0.1.0,Python开发工作流团队,开发工具,专为AI助手设计的完整Python项目开发工作流，从需求分析到项目交付,"6        # 自动化程度 (1-10, 10最自动化)",中级到高级,2025-07-16,"uv (包管理), pytest (测试), black (格式化), mypy (类型检查)","7        # 难度等级 (1-10, 10最难)","9     # 文档完整度 (1-10, 10最完整)",1-2个月,中文,"6    # 学习曲线 (1-10, 10最陡峭)","5       # 维护难度 (1-10, 10最难维护)",,"项目结构, 配置文件, 开发文档, 测试框架",7.0     # 总体评分 (1-10),"8      # 实用性 (1-10, 10最实用)","Python编程基础, 软件工程概念, 版本控制(Git)使用, 命令行操作","现代化工具链, 标准化流程, 质量优先, 快速交付",,"Python开发者, 软件工程师, 全栈开发者, 技术团队负责人, DevOps工程师","9       # 可扩展性 (1-10, 10最可扩展)","Python开发, 项目工作流, uv包管理, 技术选型, 项目架构, 开发规范, 测试驱动","6    # 出结果速度 (1-10, 10最快)",2025-07-16,"Python项目架构设计, 技术栈选择指导, 开发流程规范, 测试策略制定, 文档标准化"
04_simple_code.md,简洁代码实现专家AI提示词,v0.1.0,快速开发工作流团队,开发工具,专注于极简代码实现的AI助手，用最少代码解决实际问题,"5        # 自动化程度 (1-10, 10最自动化)",初级,2025-07-16,,"3        # 难度等级 (1-10, 10最难)","7     # 文档完整度 (1-10, 10最完整)",1-2周,中文,"2    # 学习曲线 (1-10, 10最陡峭)","8       # 维护难度 (1-10, 10最难维护)",,"Python脚本, 简洁README, 项目结构",5.9     # 总体评分 (1-10),"8      # 实用性 (1-10, 10最实用)","基础编程概念, Python基础语法","极简主义, 实用优先, 序号命名, 单文件原则",,"编程初学者, 快速原型开发者, 学生和教学人员, 小型项目需求者, 脚本工具开发者","4       # 可扩展性 (1-10, 10最可扩展)","极简开发, 快速原型, 序号命名, MVP开发, 零配置, 标准库优先","10   # 出结果速度 (1-10, 10最快)",2025-07-16,"快速原型开发, 简洁代码实现, 最小可行产品(MVP), 学习示例, 工具脚本"
05_project_ideation.md,项目创意实现工作流 - AI助手指南,v0.1.0,项目创意工作流团队,开发工具,专为AI助手设计的项目创意到实现的完整工作流，从想法分析到扩展规划,"7        # 自动化程度 (1-10, 10最自动化)",中级,2025-07-19,"创意分析框架, 技术选型矩阵, Mermaid流程图","6        # 难度等级 (1-10, 10最难)","9     # 文档完整度 (1-10, 10最完整)",1-2周,中文,"5    # 学习曲线 (1-10, 10最陡峭)","6       # 维护难度 (1-10, 10最难维护)",,"可行性分析报告, 技术实现路径, 流程图(Mermaid), 扩展规划",7.25    # 总体评分 (1-10),"9      # 实用性 (1-10, 10最实用)","基础编程概念, 项目管理意识, 技术选型了解","创意驱动, 快速验证, 渐进式开发, 可视化思维",,"产品经理, 技术负责人, 独立开发者, 创业者, 学生","8       # 可扩展性 (1-10, 10最可扩展)","项目创意, 可行性分析, 快速原型, 技术选型, 流程设计, 扩展规划","8    # 出结果速度 (1-10, 10最快)",2025-07-19,"项目创意评估, 技术方案设计, 实现路径规划, 流程可视化, 扩展策略制定"
06_xiaohongshu_writing.md,小红书爆款写作工作流 - AI助手指南,v0.1.0,内容创作工作流团队,内容创作,专为AI助手设计的小红书爆款内容创作工作流，从文案策划到图片建议,"6        # 自动化程度 (1-10, 10最自动化)",中级,2025-07-19,"小红书平台规则, 用户心理学, 视觉设计原理","5        # 难度等级 (1-10, 10最难)","8     # 文档完整度 (1-10, 10最完整)",3-5天,中文,"4    # 学习曲线 (1-10, 10最陡峭)","7       # 维护难度 (1-10, 10最难维护)",,"完整文案, 排版方案, 图片建议, 互动策略",7.0     # 总体评分 (1-10),"9      # 实用性 (1-10, 10最实用)","小红书平台了解, 基础文案写作, 目标用户认知","用户导向, 情感共鸣, 视觉吸引, 价值传递",,"内容创作者, 社交媒体运营, 品牌营销人员, 个人博主, 电商从业者","8       # 可扩展性 (1-10, 10最可扩展)","小红书, 内容创作, 爆款文案, 社交媒体, 排版设计, 图文策划","9    # 出结果速度 (1-10, 10最快)",2025-07-19,"小红书内容创作, 爆款文案写作, 社交媒体营销, 图文排版设计, 内容策划"
